{
  "schema_version": 1,
  "manifest_id": "remotebsp-maturity-baseline-v1",
  "evidence_as_of": "2026-09-10",
  "status_definitions": {
    "absent": "当前仓库没有足以支持该层级结论的证据。",
    "partial": "已有明确证据，但覆盖范围或复现材料仍不完整。",
    "verified": "该层级当前声明的范围有可定位、可复核的仓库证据。",
    "not_applicable": "该维度在此层级不适用；不能把它换算成已验证。"
  },
  "dimensions": [
    {
      "id": "determinism",
      "title": "确定性与实时边界",
      "summary": "协议、时钟模型、Mock 运动执行和 MCU 有界队列已有实现与软件测试；实体波形和最坏时延尚未形成统一证据。",
      "implemented": {
        "status": "verified",
        "evidence": [
          {"id": "determinism_clock_source", "kind": "source", "path": "toolbusd/src/clock_model.cpp", "note": "主机时钟拟合、误差老化和状态判定实现。"},
          {"id": "determinism_motion_source", "kind": "source", "path": "mock_mcu/src/motion_executor.cpp", "note": "确定性 Mock 运动时间线与安全状态实现。"}
        ],
        "blocker_ids": []
      },
      "automated_test": {
        "status": "verified",
        "evidence": [
          {"id": "determinism_clock_test", "kind": "host_test", "path": "tests/clock_model_tests.cpp", "note": "覆盖漂移、RTT、老化和回绕。"},
          {"id": "determinism_motion_mock_test", "kind": "mock_test", "path": "tests/motion_executor_tests.cpp", "note": "这是 Mock 执行器测试，不是实体 STEP 波形实测。"}
        ],
        "blocker_ids": []
      },
      "cross_compiled": {
        "status": "partial",
        "evidence": [
          {"id": "determinism_cross_document", "kind": "documented_cross_compile_result", "path": "docs/stm32-build-and-flash.md", "note": "文档记录三类 STM32 运动后端交叉编译；未附统一可重放构建记录。"}
        ],
        "blocker_ids": ["determinism_hardware_timing"]
      },
      "hardware_verified": {
        "status": "partial",
        "evidence": [
          {"id": "determinism_hardware_document", "kind": "documented_hardware_result", "path": "docs/weact-stm32g431cbu6-core.md", "note": "记录单轴空载步数验证；不覆盖抖动、跨板同步或最坏负载。"},
          {"id": "determinism_g431_dl16_document", "kind": "documented_hardware_result", "path": "docs/hardware-evidence-g431-2026-09-10.md", "note": "PA6/D5 已采集1kHz/50%、1kHz/12.34%、100kHz/50%和100kHz/25%，全部0毛刺；最高频组为50MHz/2ms、400边沿，最短脉宽2.5µs，生命周期修复固件重复通过100kHz/25%。仅证明单路PWM，不覆盖STEP、最坏负载或跨板同步。"}
        ],
        "blocker_ids": ["determinism_hardware_timing"]
      }
    },
    {
      "id": "resource_model",
      "title": "通用资源模型",
      "summary": "GPIO、UART、PWM、位流、运动、I2C/SPI 和 Stream 已部分贯通；公共 Core ResourceReset 已恢复 UART 清缓冲/故障并释放、PWM stop、TimedBitstream abort 的兼容语义，失败时保留对象和故障状态。G431 I2C1/SPI1/SPI2 板级 HAL 已交叉编译，生产代码已有主机 HAL 桩覆盖 flags、超时、恢复和 SPI CS，但未烧录或电气实测；H2N/N2H Stream 已到 Mock，ADC、Timer、Storage、双向流与实体高速数据面缺失。",
      "implemented": {
        "status": "partial",
        "evidence": [
          {"id": "resource_contract_document", "kind": "document", "path": "docs/bus-and-stream-resources.md", "note": "定义总线、设备与高速流资源边界。"},
          {"id": "resource_protocol_source", "kind": "source", "path": "protocol/src/resource.cpp", "note": "资源描述、合同和状态协议实现。"},
          {"id": "resource_bus_runtime_source", "kind": "source", "path": "toolbusd/src/bus_runtime.cpp", "note": "有界设备合同缓存、首访单飞、父总线非阻塞仲裁和节点失效处理。"},
          {"id": "resource_static_table_source", "kind": "source", "path": "firmware/src/static_resources.c", "note": "Studio 生成 GPIO/UART/PWM/定时位流表的启动完整性和运行白名单公共消费者。"},
          {"id": "resource_embedded_enum_source", "kind": "source", "path": "firmware/src/core.c", "note": "STM32 Remote Core 已把静态表接入 ResourceEnum/Describe/Status/Contract；ResourceReset 对 UART/PWM/TimedBitstream 执行兼容恢复，后端失败时保留对象和故障状态。"},
          {"id": "resource_g431_bus_hal_source", "kind": "source", "path": "firmware/boards/stm32g431cbu6/board_bus.c", "note": "G431 I2C1/SPI1/SPI2 板级 HAL 与静态端点；已有交叉编译及主机 HAL 桩证据，未烧录或电气验收。"}
        ],
        "blocker_ids": ["incomplete_resource_families"]
      },
      "automated_test": {
        "status": "partial",
        "evidence": [
          {"id": "resource_model_test", "kind": "host_test", "path": "tests/resource_tests.cpp", "note": "资源协议与约束测试。"},
          {"id": "resource_bus_mock_test", "kind": "mock_test", "path": "tests/bus_resource_tests.cpp", "note": "I2C/SPI 为 Mock 事务验证，不代表实体外设验证。"},
          {"id": "resource_bus_embedded_test", "kind": "host_test", "path": "firmware/tests/bus_core_tests.c", "note": "默认关闭的嵌入式公共总线 Core/HAL 边界测试，不代表板级 HAL 可用。"},
          {"id": "resource_stream_session_test", "kind": "mock_test", "path": "tests/stream_session_tests.cpp", "note": "H2N 有界会话、租约、序号、背压与清理测试；Mock 不是实体实测。"},
          {"id": "resource_stream_n2h_test", "kind": "mock_test", "path": "tests/stream_n2h_session_tests.cpp", "note": "N2H 精确累计 ACK、两阶段交付、回绕、溢出、租约到期和跨资源/节点隔离；Mock不是实体实测，且未绑定真实高速链路。"},
          {"id": "resource_bus_runtime_test", "kind": "host_test", "path": "tests/bus_runtime_tests.cpp", "note": "覆盖合同边界、首访单飞、父总线争用、跨节点隔离和失效期间 ABA 防护；不代表实体总线时序。"},
          {"id": "resource_static_table_test", "kind": "host_test", "path": "firmware/tests/startup_gpio_tests.c", "note": "覆盖静态资源表边界、跨类型引脚冲突与 UART/波形白名单；不代表实体引脚时序。"},
          {"id": "resource_embedded_enum_test", "kind": "host_test", "path": "firmware/tests/core_tests.c", "note": "覆盖 STM32 ResourceEnum/Describe/Status/Contract，以及 ResourceReset 的 UART/PWM/TimedBitstream 成功、所有权和后端失败保留语义。"},
          {"id": "resource_g431_bus_hal_test", "kind": "host_test", "path": "firmware/tests/g431_board_bus_tests.c", "note": "直接编译生产 board_bus.c 并以 HAL 桩覆盖 I2C flags、统一超时预算、可选恢复、SPI CS 和失败恢复；不代表实体外设或引脚时序。"}
        ],
        "blocker_ids": ["incomplete_resource_families"]
      },
      "cross_compiled": {
        "status": "partial",
        "evidence": [
          {"id": "resource_cross_document", "kind": "documented_cross_compile_result", "path": "docs/bus-and-stream-resources.md", "note": "三平台默认关闭态已检查零总线符号；G431 I2C1/SPI1/SPI2 专用配置已交叉编译，不代表已烧录或实板验收。"},
          {"id": "resource_enum_cross_document", "kind": "documented_cross_compile_result", "path": "docs/hardware-evidence-g431-2026-09-10.md", "note": "Resource 四命令修复后 F072、F103、两块正式板型和 G431 共六个目标交叉编译通过；这是构建证据，不替代实体资源事务。"}
        ],
        "blocker_ids": ["incomplete_resource_families"]
      },
      "hardware_verified": {
        "status": "partial",
        "evidence": [
          {"id": "resource_hardware_document", "kind": "documented_hardware_result", "path": "docs/weact-bluepill-plus.md", "note": "记录 GPIO、UART 与 CAN 实体验证；不覆盖全部资源族。"},
          {"id": "resource_g431_enum_hardware", "kind": "documented_hardware_result", "path": "docs/hardware-evidence-g431-2026-09-10.md", "note": "G431 经实体 CAN-FD 枚举3 UART、PWM0、TimedBitstream0并由RuntimeSnapshot返回1节点/5资源；PWM实板验证Busy->Normal、对象1停止后不复位重建对象2及最高100kHz波形，不证明其余资源的全部电气与时序行为。"}
        ],
        "blocker_ids": ["incomplete_resource_families"]
      }
    },
    {
      "id": "multi_node_synchronization",
      "title": "多节点同步",
      "summary": "TimeSync v1、主机时钟模型、有界同步调度、toolbusd 事务入口、STM32 参与者、STEPGEN 租约和通用启动代次日志已实现；日志尚未绑定实体保留区，三板继续安全禁用跨板入口。",
      "implemented": {
        "status": "partial",
        "evidence": [
          {"id": "sync_manager_source", "kind": "source", "path": "toolbusd/src/clock_sync_manager.cpp", "note": "周期同步请求与生命周期管理。"},
          {"id": "sync_group_source", "kind": "source", "path": "toolbusd/src/motion_group_service.cpp", "note": "多节点 PREPARE/COMMIT/ABORT 软件服务。"},
          {"id": "sync_embedded_source", "kind": "source", "path": "firmware/src/motion_group.c", "note": "STM32 公共 Remote Core 的可选参与者、完成水位、防重放和安全停机实现。"},
          {"id": "sync_boot_epoch_source", "kind": "source", "path": "device_params/src/boot_epoch.c", "note": "通用双页启动代次日志；尚未绑定任何实体板 Flash 区。"}
        ],
        "blocker_ids": ["multi_node_hardware_sync"]
      },
      "automated_test": {
        "status": "verified",
        "evidence": [
          {"id": "sync_scheduler_test", "kind": "host_test", "path": "tests/clock_sync_scheduler_tests.cpp", "note": "覆盖容量、周期、离线和超时。"},
          {"id": "sync_group_mock_test", "kind": "mock_test", "path": "tests/motion_group_service_tests.cpp", "note": "双 Mock Remote Core 事务测试，不是跨板实测。"},
          {"id": "sync_group_process_test", "kind": "mock_test", "path": "tests/multi_node_e2e.sh", "note": "双节点 vcan 与 Mock USB 进程级 PREPARE/COMMIT/取消闭环；纯软件测试使用 10 ms 时钟门槛，不是实体跨板精度实测。"},
          {"id": "sync_embedded_host_test", "kind": "host_test", "path": "firmware/tests/motion_group_tests.c", "note": "参与者状态机、防重放、启动代次和调度失败安全路径测试。"}
        ],
        "blocker_ids": []
      },
      "cross_compiled": {
        "status": "partial",
        "evidence": [
          {"id": "sync_embedded_cross_document", "kind": "documented_cross_compile_result", "path": "docs/embedded-motion-groups.md", "note": "F072/F103/G431 运动配置已交叉编译；三款板尚未提供经验证的可靠 motion_boot_epoch。"}
        ],
        "blocker_ids": ["multi_node_hardware_sync"]
      },
      "hardware_verified": {"status": "absent", "evidence": [], "blocker_ids": ["multi_node_hardware_sync"]}
    },
    {
      "id": "fault_isolation",
      "title": "故障隔离",
      "summary": "请求去重、超时、节点离线、资源级错误、I2C/SPI 父总线隔离和 H2N/N2H 逻辑传输会话录制/故障回放已有软件闭环；网络分区和实体压力恢复仍不完整。",
      "implemented": {
        "status": "partial",
        "evidence": [
          {"id": "fault_request_source", "kind": "source", "path": "toolbusd/src/request_manager.cpp", "note": "有界请求、重试、取消和响应匹配。"},
          {"id": "fault_runtime_source", "kind": "source", "path": "runtime_api/toolbusd_provider.py", "note": "资源级失败隔离、缓存失败合并和时钟质量告警。"},
          {"id": "fault_embedded_lease_source", "kind": "source", "path": "firmware/src/core.c", "note": "STEPGEN 与总线设备租约释放、过期、会话结束及复位联动。"},
          {"id": "fault_bus_runtime_source", "kind": "source", "path": "toolbusd/src/bus_runtime.cpp", "note": "同父总线非阻塞互斥、异常释放和节点合同失效。"},
          {"id": "fault_replay_source", "kind": "source", "path": "mock_mcu/src/board_manifest.cpp", "note": "版本化故障记录、完整输入/状态摘要和确定性状态回放。"},
          {"id": "fault_transport_replay_source", "kind": "source", "path": "mock_mcu/src/transport_replay.cpp", "note": "有界 RecordingLinkTransport 会话、按路由归因的 H2N/N2H 帧及 delay/drop/duplicate/reboot 逻辑传输模型；录制失败不改变数据面语义，不模拟真实 CAN/USB 物理层。"}
        ],
        "blocker_ids": ["partial_failure_recovery"]